tags,title
odessarae g.j.echternkamp patrickwilson davidslade crime drama thriller chatting missing person poster online dating photographer sexual predator,hard candy
katymixon davidgallagher ediefalco jamiebabbit drama thriller deaf death dysfunctional family godparent secret,the quiet
sarahkazemy rezasixosafai sinaamedson maryamkeshavarz drama closeted lesbian iranian islamophobia propaganda teenager,circumstance
ahnao'reilly meloniediaz ariananeal ryancoogler biography drama romance 22 year old b.a.r.t. bay area birthday police,fruitvale station
jackmcbrayer michaelangarano aliashawkat ramaamosley comedy fantasy thriller mini dress mini skirt money voyeur voyeurism,the brass teapot
samedwards donniedunagan anngillis jamesalgar animation drama family animal bambi deer forest hunter,bambi
johnenosiii rianbishop adamcarolla charlesherman-wurmfeld comedy romance sport birthday boxing coach gym olympics,the hammer
dwaynejohnson haroldperrineau nadinevelazquez ricromanwaugh action drama thriller cigarette smoking dea drugs inspired by true events undercover,snitch
josephgordon-levitt robmcelhenney jacquelinebisset c.jaycox comedy drama romance christian male frontal nudity mormon mormon missionary nudity,latter days
stanaroumillac christophecherki teddydoloir mariettemonpierre drama foreign french,elza
bokeemwoodbine rubydee quintonaaron tommyoliver drama number in title semi autobiographical,1982
jameswolk arigraynor niavardalos jamietravis comedy friend friendship gay phone sex sex,"for a good time, call..."
arigraynor janelparrish robhuebel leetolandkrieger comedy drama romance best friends friendship masturbation reference to matthias steiner single,celeste & jesse forever
gavinmacleod d.davidmorin hallinden richchristiano drama fantasy sci-fi bible christian propaganda christianity time machine zealot,time changer
lorrainestanley johnnyharris georgiagroome paulandrewwilliams crime drama thriller bathroom chase girl pimp toilet,london to brighton
eddiegriffin christopherberry michelletabora nicklove action comedy drama sci-fi father son relationship female nudity mother daughter relationship reconciliation superhero,american hero
tommyo'reilly samairearmstrong mattcohen nataliebible' mystery thriller,windsor drive
shahabhosseini leilahatami peymanmoaadi asgharfarhadi drama mystery alzheimer's disease caregiver divorce iran iranian,a separation
johartley stephenmccole joecassidy justinmolotnikov thriller cocaine edinburgh scotland stand up comedian,crying with laughter
heathermatarazzo kenleung christinavidal toddsolondz comedy drama bully first crush school social outcast taunting,welcome to the dollhouse
allisondean toddfield dorothylyman victornunez drama romance desire florida identity resort town sales,ruby in paradise
victorrasuk meloniediaz judymarte petersollett drama romance based on short film manhattan new york city urination vomiting watching television,raising victor vargas
louisebrooks francislederer fritzkortner georgwilhelmpabst crime drama romance escape femme fatale german expressionism lust violence,pandora's box
martinlandau melorawalters dianebaker danieldavila drama abusive relationship character name in title magic san francisco california tenderloin san francisco,harrison montgomery
normaaleandro hildabernard claudialapacó jorgegaggero drama buenos aires argentina economics housekeeper maid servant,live-in maid
kevinpollak kathrynmorris timothyhutton rodlurie drama thriller colorado diner iraq nuclear missile president,deterrence
zacharyknighton tomguiry ryandonowho michaelburke crime drama romance death farm fur coat grief misfit,the mudge boy
lesliebibb eionbailey arlyjover catherinejelski drama based on play independent film,the young unknowns
shanedawson kurtangle cheramileigh shanedawson comedy,not cool
bjørnsundquist stigfrodehenriksen anedahltorp tommywirkola comedy horror medical student nazi snow snowmobile zombie,dead snow
corbinallred larrybagby kirbyheyborne ryanlittle action adventure drama war ardennes forest battle of the bulge behind enemy lines winter world war two in belgium,saints and soldiers
taylorpigeon alanpietruszewski whitspurgeon clarkbaker horror sci-fi short thriller alien flight attendant monster pilot tentacle,vessel
harrisonford ronhoward mackenziephillips georgelucas comedy drama music california car drag racing high school rock 'n' roll,american graffiti
scotthelvenston katyhelvenston-wettengal donnazovko robertgreenwald documentary war american politics armed forces political corruption shady war profiteer,iraq for sale: the war profiteers
tinafey fredarmisen chriskattan mattmaiellaro action adventure animation comedy fantasy sci-fi based on cult tv series critically acclaimed exercise machine midnight movie robot,aqua teen hunger force colon movie film for theaters
marylynnrajskub markduplass jeffgarlin colintrevorrow comedy drama romance classified ad intern magazine time machine time travel,safety not guaranteed
isaacc.singletonjr. larryking jeanettebranch lesliesmall comedy documentary stand up comedy,kevin hart: laugh at my pain
myannaburing bencrompton neilmaskell benwheatley crime horror thriller female full frontal nudity hitman knee breaking male full frontal nudity sniper,kill list
lenadunham jakeryan pathealy tiwest horror bathtub dead body in a bathtub dead body in bathtub hotel inn,the innkeepers
garyoldman atticusshaffer rachelbrosnahan davids.goyer drama fantasy horror mystery thriller babysitting experiment nightmare possession twin,the unborn
jean-louistrintignant stefaniasandrelli dominiquesanda bernardobertolucci drama fascist gun italy nudity sexuality,the conformist
raymondj.barry christelkhalil reneefaia neilburger drama conspiracy theory kennedy assassination mock documentary paranoia,interview with the assassin
julianmorris nicholaburley tomburke oliverblackburn crime drama horror thriller male frontal nudity male nudity male pubic hair male rear nudity spain,donkey punch
lukegrimes michaelwelch whitneyable jonathanlevine horror drugs female nudity party voyeur voyeurism,all the boys love mandy lane
dichenlachman jenniferleewiggins michelemorrow christopherhutson horror artist blood drug tree sap vampire,bled
garycooper lloydbridges lonchaneyjr. fredzinnemann thriller western appeasement frontier justice justice one against many street shootout,high noon
williamgates arthuragee isiahthomas stevejames documentary drama sport athlete basketball high school high school student school,hoop dreams
kevinscottrichardson christophertoler tommytheclown davidlachapelle documentary music clown clowning dance gang south central los angeles,rize
peterdinklage laurencohan erickavari josephkosinski action adventure fantasy sci-fi first person shooter,destiny
adamlefevre brucealtman waltermasterson michaelcuesta crime drama ephebophile pederasty pedophilia playing hooky shaving,l.i.e.
laurafraser karahayward louisozawachangchien carynwaechter drama mystery thriller accused of witchcraft based on short story,the sisterhood of night
aimeegarcia wesleyjonathan drewsidora emilydell drama music romance brooklyn new york city los angeles california teacher trauma violence,b-girl
naomiwatts thomaskretschmann evanparke peterjackson action adventure drama romance animal name in title ape abducts a woman gorilla island king kong,king kong
robertri'chard parishilton brianvanholt jaumecollet-serra horror brother sister relationship group of friends male nudity twin wax,house of wax
ryangosling tristanmackwilds jefflima ryanfleck drama bathroom classroom dialectics drugs student,half nelson
irenebedard akima maxgail jenniferwynnefarmer drama cosmetics female protagonist native american native american protagonist sister sister relationship,naturally native
hillharper robinnelee chenoamaxwell christopherscottcherot comedy friend new year's eve screwball self discovery social differences,hav plenty
mehcadbrooks steffinniephrommany daniellesavre h.m.coakley crime drama thriller cheating husband female nudity male nudity male rear nudity revenge,adulterers
treyloney leearmstrong amylucas randymoore fantasy horror diarrhea female nudity middle aged man sex scene sexy nurse,escape from tomorrow
richardcurtis harveyweinstein eltonjohn chrisatkins documentary celebrity consumerism fashion media manipulation,starsuckers
alfrewoodard davefennoy janegoodall billbenenson documentary east africa hunter gatherer indigenous rift valley swahili,the hadza: last of the first
sandraellislafferty madisonlintz karolinawydra ryansmith fantasy horror mystery thriller coma crash,after
matthewziff lorraineziff michaelbiehn travisromero drama thriller panties white panties,treachery
levenrambin justinkirk virginiamadsen annamastro comedy drama based on short film based on short story,walter
gingerrogers edwardeveretthorton ericblore marksandrich comedy musical romance dance dancer dancing horse tap dancing,top hat
heatherdonahue joshualeonard michaelc.williams danielmyrick horror found footage looking at the camera lost in the woods maryland screaming in horror,the blair witch project
joecocker jimihendrix joanbaez michaelwadleigh documentary history music drugs hippie music festival the who woodstock,woodstock
davidzucker barrydennen tarastrohmeier johnlandis comedy fake commercial fake newscast fake trailer parody spoof,the kentucky fried movie
stacykeach davida.r.white cynthiawatros jongunn action crime drama church cigarette smoking deacon twin brother twins,mercy streets
kendyljoi matthewfeeney tacfitzgerald geneteigland mystery thriller,arnolds park
williamsmith jasonlondon brentdavidfraser scottziehl drama independent film katana sword los angeles storm drain,broken vessels
nicholasgonzalez angelanordeng exiebooker richardmontoya crime drama,water & power
alioutouré garbatouré khairaarby johannaschwartz documentary,they will have to kill us first
karenalexander colinandrews francineblake williamgazecki documentary crop circle intelligence paranormal phenomenon universe,crop circles: quest for truth
russellwong stevenmichaelquezada lymarinadal lancemcdaniel action drama thriller china faith panama photography suspense,light from the darkroom
françoiscluzet félixmoati mariannedenicourt thomaslilti comedy drama doctor hospital mayor no opening credits title at the end,irreplaceable
paulagarcés annabellasciorra johnbrodsky michaelwalker thriller,the maid's room
paulmccartney ringostarr georgeharrison richardlester comedy musical boy concert drummer manager television,a hard day's night
unknown unknown unknown u.robertoromano documentary child labor education hispanic labor migration,the harvest/la cosecha
jamieleecurtis sallykirkland amymadigan amyholdenjones drama romance 1980s affair female protagonist radio woman wearing only a man's shirt,love letters
darionozicserini spelacolja andrejnahtigal blazzavrsnik comedy,julija in alfa romeo
kirkcameron kenbevel erinbethea alexkendrick drama romance christian film dare firefighter internet pornography marriage,fireproof
bholebaba pantshirtbaba shrimanumeshanadbrahmachari pannalin biography documentary drama faith ganja kumbh mela little boy orphan,faith connections
francesbavier peterbreck edgarbuchanan joecamp adventure family romance animal abuse cat dog dog movie tween girl,benji
blanchardryan saulstein danieltravis chriskentis adventure biography drama horror thriller bare chested male female full frontal nudity hairy chest male full frontal nudity nude with glasses,open water
joelotruglio mattjones abbyelliott mattwalsh comedy,high road
woodystrode hokehowell tiffanybolling john'bud'cardos horror sci-fi death farm hotel spider tarantula,kingdom of the spiders
heatherberman evacarrozza pauldaggett marilynagrelo documentary family music ballroom dancing new york city poise self confidence teacher,mad hot ballroom
peterdinklage joelotruglio paulagarcés tommccarthy comedy drama abandoned depot dwarf newfoundland new jersey train,the station agent
randywayne seanmichaelafable d.davidmorin brianbaugh drama basketball beer pong childhood friend christian suicide,to save a life
kenburns billclinton bobdole patrickcreadon documentary comedian crossword puzzle editor new york times puzzle,wordplay
terryfunk vincemcmahon mickfoley barryw.blaustein biography documentary sport championship drugs three word title wrestler wrestling,beyond the mat
kirbyheyborne lincolnhoppe daryntufts kurthale comedy drama romance church love marriage mormon single,the singles ward
marinagolbahari zubaidasahar mohamadharefharati siddiqbarmak drama boy girl hair school taliban,osama
racheldratch peterriegert jasonkravits josephdorman documentary jewish identity,sholem aleichem: laughing in the darkness
racheltrue arigold dennykirkwood gregharrison drama music dj ecstasy the drug rave raver warehouse,groove
kirbyheyborne bigbudah curtdoussett kurthale comedy crime family latter day saints missionary pickup truck police video camera,the r.m.
sashaalexander williamkatt jongries michaelpolish drama conjoined twins independent film low budget film separation twin,twin falls idaho
roryculkin scottmechlowicz trevormorgan jacobaaronestes crime drama boat bully dare friend river,mean creek
ediefalco heathermatarazzo lynncohen morganj.freeman crime drama romance gang new mexico prison smuggling theft,hurricane streets
peterdinklage billduke michaelmckean ericschaeffer comedy romance bar gay bar love mother son relationship new york,never again
monicacalhoun lisarayemccoy cliftonpowell neemabarnette crime drama thriller abuse of power friendship prison prison guard title directed by female,civil brand
kevincorrigan seymourcassel marykayplace stevebuscemi comedy drama bail coma dart board indiana ladder factory,lonesome jim
oliviawilde annakendrick tiwest joeswanberg comedy drama romance brewery co worker male female friendship u haul truck woman wearing a string bikini,drinking buddies
davidmamet rickyjay dickcavett mollybernstein documentary stage magician,deceptive practice: the mysteries and mentors of ricky jay
takashishimura minoruchiaki kamatarifujiwara akirakurosawa action adventure drama 16th century battle japan practice samurai,seven samurai
tommysheppard gregspeirs mickeyhart mariusa.markevicius documentary sport basketball basketball team grateful dead lithuanian olympics,the other dream team
bradpitt tinalouise nickcave tomdicillo comedy music romance idol musician vomiting watching television wyoming,johnny suede
moniquegabrielacurnen jakesandvig joemcqueen justinlin comedy bruce lee jeet kune do karate satire spoof,finishing the game: the search for a new bruce lee
haleyramm jackplotnick ceceliaantoinette quentindupieux comedy fantasy horror desert dump show spectator tire,rubber
jimparsons mattjones aprilwinchell timjohnson adventure animation comedy family fantasy sci-fi alien friendship alien invasion australia flying car mother daughter relationship,home
torispelling amberbenson garrettm.brown c.jaycox comedy romance best friend high school love secret wedding,kiss the bride
ryangosling cleaduvall eddiespears alexsmith drama sport cheerleader father son relationship football coach loss of father mother son relationship,the slaughter rule
scootmcnairy whitneyable rickycatter garethedwards drama sci-fi thriller alien alien invasion destroyed building destruction mexico,monsters
keithcarradine joannewhalley illeanadouglas jonathanparker drama based on novel,the californians
jimgaffigan anndowd matthewcowles soltryon comedy artist black comedy,the living wake
justinchon christab.allen maxadler alexcraigmann comedy horror based on play blood independent film teenager zombie,detention of the dead
bohuang zhengxu zhonghuachen haoning comedy crime bankruptcy crystal father son relationship heist shower,crazy stone
brianeno jacquesbrel damonalbarn stephenkijak biography documentary music avant garde british pop character name in title musician number in title,scott walker: 30 century man
radhamitchell alanruck meganmullally marcforster drama group of friends mental breakdown mental instability morgue sudden infant death syndrome,everything put together
brucegreenwood zoëkravitz stafforddouglas andrewniccol drama thriller cigarette butt drone funeral procession nellis air force base taliban,good kill
dastonkalili raialexandra chin-chienchang dastonkalili thriller,insomnia manica
carolchanning brucevilanch tonybennett williamgazecki documentary,the outrageous sophie tucker
jeremyirvine oliviawilliams paddyconsidine olparker drama romance death dying leukemia teenage girl terminal illness,now is good
vincentchimato johnmcglothlin alsapienza michaelhoffmanjr. comedy horror mini skirt party spring break voyeur war hammer,girls gone dead
emmacaulfield dylanbaker mikecolter patrickgilles history,america is still the place
mikebeckingham timabell tomstedham georgiahilton action mystery thriller military submarine suspense time travel world war two,subconscious
britneyspears katherineboecher daveallen tamradavis comedy drama audition friendship graduation high school graduation love,crossroads
shaunsipos katherinewaterston christopherdenham jackheller mystery thriller cabin going in circles pac man stranger woods,enter nowhere
mannyperez christianalvarez claudettelalí fernandobaezmella crime drama,the king of najayo
jenniferhale randyjayburrell vincentdepaul warrensheppard action romance sport fighting karate,fight to the finish
paulsorvino barrybostwick terrancezdunich darrenlynnbousman horror musical carnival devil redemption reference to god,alleluia! the devil's carnival
marykatewiles jenniferlanda felixavitia justinpaulmiller comedy mystery thriller,the sound and the shadow
carriebradstreet joelpaulreisig yassiehawkes joelpaulreisig family,rodeo girl
elizabethstreb sarahcallan lauraflanders catherinegund action biography documentary sport three word title,born to fly: elizabeth streb vs. gravity
mikestanley jeffdelaney jamisonstalsworth lukedye family,the little ponderosa zoo
timholmes milakunis jamesfranco samraimi adventure family fantasy circus magic magician oz witch,oz the great and powerful
patrickkilpatrick marktorgl patryan michaelherz action comedy horror sci-fi boy health club superhero toxic waste troma,the toxic avenger
lawrencegilliardjr. georget.odom mattyrich mattyrich crime drama domestic violence housing project new york city poverty racism,straight out of brooklyn
jamesnesbitt nicholasfarrell timpigott-smith paulgreengrass drama history war civil rights irish march northern ireland protest march,bloody sunday
luissanchez dennisl.a.white fredrostarr alecasten action prison prisoner reverend terminal illness two word title,diamond ruff
oliviawilde thomaslennon norazehetner hanscanosa comedy drama romance female frontal nudity filming a wedding lingerie slip memory wedding,conversations with other women
johnkaryus lloydkaufman kategraham lloydkaufman comedy horror musical castration chicken fast food indian burial ground protest,poultrygeist: night of the chicken dead
jenniferlafleur cheyennejackson michaelstahl-david matthewwatts comedy romance bromance manhattan new york city new york city photograph surprise,mutual friends
gingerrogers dickpowell georgebrent lloydbacon comedy musical romance chorus girl chorus line director gala premiere song,42nd street
bobproctor jackcanfield ericworre joekenemore documentary business entrepreneur network marketing,rise of the entrepreneur: the search for a better way
chriseigeman taylornichols elliathompson whitstillman comedy drama romance apartment dancing debutante new york upper class,metropolitan
michaelnyqvist fridahallgren nils-andersvallgårda kaypollak comedy drama music romance amazing grace the hymn choir heart attack hometown skidding truck,as it is in heaven
jacke.curenton acemarrero alanpietruszewski ericengland drama horror mystery thriller dog gun hostage husband wife relationship jealousy,roadside
jonheder diedrichbader jongries jaredhess comedy class president family relationships friend high school jock,napoleon dynamite
devinratray eveplumb amyhargreaves jeremysaulnier crime drama thriller blood splatter car neo noir vengeance vomiting,blue ruin
micahsloat ashleypalmer amberarmstrong orenpeli horror dark force entity evil force found footage paranormal phenomenon,paranormal activity
tonyalva jayadams jeffament stacyperalta documentary sport california drought playground skateboarding surfer,dogtown and z-boys
ericidle michaelpalin terryjones terrygilliam adventure comedy fantasy camelot holy grail king arthur knight lancelot,monty python and the holy grail
emilyrios jessegarcia aliciasixtos richardglatzer drama 15th birthday birthday gay party security guard,quinceañera
tonydoupe suecorcoran davidfrederickwhite suecorcoran comedy fantasy horror musical conspiracy feminist hippie motorcycle slapstick comedy,gory gory hallelujah
sendhilramamurthy masioka greggrunberg unknown drama fantasy sci-fi thriller father daughter relationship serial killer superhero supernatural power vision of the future,heroes            
gregayres jonathancaouette reneeleblanc jonathancaouette biography documentary answering machine home movie lithium schizophrenic video diary,tarnation
billfarmer chriscox mikehuckabee raygriggs documentary,i want your money
kanehodder paulelia alexsanborn mattjackson comedy horror bigfoot love monster sasquatch tourist,love in the time of monsters
catrionamaccoll davidwarbeck alcliver luciofulci horror doctor hell hotel painter plumber,the beyond
brendonsmall ronlynch melissabardingalsky unknown animation comedy drama coach friend school series tv series,home movies            
treatwilliams andrewdaly michellekrusiec tomvaughan comedy romance casino father son relationship jackpot judge wedding,what happens in vegas
dovtiefenbach jeffseymour gordoncurrie paulfox horror thriller brain tumor champagne game psychiatrist weekend,the dark hours
saeedjaffrey roshanseth garrycooper stephenfrears comedy drama romance england mistress pakistani politics thatcher,my beautiful laundrette
r.brandonjohnson adamlefevre desmondaskew arikirschenbaum drama horror mystery thriller,fabled
katharineisabelle michellenolden gabrielhogan cassandranicolaou drama thriller bathtub implied incest lesbian squeegee tied to a chair,show me
livullmann ingridthulin erlandjosephson ingmarbergman drama dying love mansion selfishness turn of the century,cries & whispers
lilliangish maemarsh walterlong d.w.griffith drama history war huguenot intolerance medicis protestant wedding,intolerance: love's struggle throughout the ages
walterkoenig deforestkelley jamesdoohan rogernygard documentary autograph dentist outer space star trek telephone call,trekkies
anitapage bessielove charlesking harrybeaumont musical romance sibling rivalry singer sister act whistling wisecrack humor,the broadway melody
tedraimi betsybaker ellensandweiss samraimi fantasy horror cult director cult film evil dead necronomicon psychotronic film,the evil dead
americaolivo noraarnezeder lianebalaban franckkhalfoun horror thriller exhibition mannequin obsession oral sex photographer,maniac
amosoz unknown unknown morloushy documentary history,censored voices
markzupan joebishop andycohn henryalexrubin documentary sport paralympics quad rugby rugby team wheelchair,murderball
michaeldudikoff stevejames larrypoindexter samfirstenberg action drama blood splatter island motorboat ninja sequel to cult film,american ninja 2: the confrontation
carolblock ellenblock mikeblock dougblock documentary address as title number in title parents,51 birch street
billyburke tracyspiridakos davidlyons unknown action adventure drama sci-fi 2020s near future one word series title post apocalypse year 2027,revolution            
tome.nicholson nataliewelch christiankapper chadkapper family sci-fi drone playing with gun post apocalypse road trip working class family,rotor dr1
jamieleecurtis donaldpleasence p.j.soles johncarpenter horror thriller halloween masked killer michael myers slasher trick or treat,halloween
jackwarden leej.cobb johnfiedler sidneylumet crime drama courtroom dialogue driven dialogue driven storyline jury murder,12 angry men
isabellarossellini petergerety lynnredgrave paulfierlinger animation drama autobiography dog movie german shepherd memoir old man,my dog tulip
claudettecolbert alanhale walterconnolly frankcapra comedy romance bus detective love money reporter,it happened one night
angelikipapoulia marytsoni sissypetropoulou yorgoslanthimos drama thriller fellatio isolated house overprotective father social isolation unsimulated sex,dogtooth
jamescagney garycoleman toddbridges laurenlazin biography documentary music hip hop name in title rap star rapper reference to tupac shakur,tupac: resurrection
kimberlyj.brown janetmcteer loissmith gavino'connor comedy drama boss fight reference to william shakespeare white trash written and directed by cast member,tumbleweeds
viggomortensen adamgoldberg virginiamadsen gregorywiden action fantasy horror mystery thriller angel corpse girl heaven soul,the prophecy
simonabkarian zinedinesoualem janebradbury cédricklapisch comedy romance cat homosexual sex male homosexuality neighborhood noisy neighbor,when the cat's away
oliverplatt adrianmartinez derekluke peterhedges comedy drama apartment oven stove thanksgiving thanksgiving dinner,pieces of april
kevinhowarth markcaven thierryharcourt nialljohnson drama breasts female frontal nudity jealousy male full frontal nudity male nudity,the big swap
daniellondon lucy willoldham kellyreichardt drama cell phone male frontal nudity oregon sexual ambiguity title directed by female,old joy
johnrobinson lucy willoldham kellyreichardt drama car dog flip phone rape threat vulnerable,wendy and lucy
