tags,title
cchpounder joeldavidmoore wesstudi jamescameron action adventure fantasy sci-fi avatar future marine native paraplegic,avatar
johnnydepp orlandobloom jackdavenport goreverbinski action adventure fantasy goddess marriage ceremony marriage proposal pirate singapore,pirates of the caribbean: at world's end
christophwaltz rorykinnear stephaniesigman sammendes action adventure thriller bomb espionage sequel spy terrorist,spectre
tomhardy christianbale josephgordon-levitt christophernolan action thriller deception imprisonment lawlessness police officer terrorist plot,the dark knight rises
dougwalker robwalker unknown dougwalker documentary,star wars: episode vii - the force awakens            
darylsabara samanthamorton pollywalker andrewstanton action adventure sci-fi alien american civil war male nipple mars princess,john carter
bradgarrett donnamurphy m.c.gainey nathangreno adventure animation comedy family fantasy musical romance 17th century based on fairy tale disney flower tower,tangled
chrishemsworth robertdowneyjr. scarlettjohansson josswhedon action adventure sci-fi artificial intelligence based on comic book captain america marvel cinematic universe superhero,avengers: age of ultron
alanrickman danielradcliffe rupertgrint davidyates adventure family fantasy mystery blood book love potion professor,harry potter and the half-blood prince
henrycavill laurencohan aland.purwin zacksnyder action adventure sci-fi based on comic book batman sequel to a reboot superhero superman,batman v superman: dawn of justice
kevinspacey marlonbrando franklangella bryansinger action adventure sci-fi crystal epic lex luthor lois lane return to earth,superman returns
giancarlogiannini mathieuamalric rorykinnear marcforster action adventure action hero attempted rape bond girl official james bond series revenge,quantum of solace
johnnydepp orlandobloom jackdavenport goreverbinski action adventure fantasy box office hit giant squid heart liar's dice monster,pirates of the caribbean: dead man's chest
johnnydepp ruthwilson tomwilkinson goreverbinski action adventure western horse outlaw texas texas ranger train,the lone ranger
henrycavill christophermeloni harrylennix zacksnyder action adventure fantasy sci-fi based on comic book british actor playing american character final battle origin of hero reboot,man of steel
peterdinklage pierfrancescofavino damiánalcázar andrewadamson action adventure family fantasy brother brother relationship brother sister relationship good versus evil king narnia,the chronicles of narnia: prince caspian
johnnydepp samclaflin stephengraham robmarshall action adventure fantasy blackbeard captain pirate revenge soldier,pirates of the caribbean: on stranger tides
willsmith michaelstuhlbarg nicolescherzinger barrysonnenfeld action adventure comedy family fantasy sci-fi alien criminal m.i.b. maximum security prison prison,men in black 3
aidanturner adambrown jamesnesbitt peterjackson adventure fantasy army elf hobbit middle earth orc,the hobbit: the battle of the five armies
emmastone andrewgarfield chriszylka marcwebb action adventure fantasy lizard outcast spider spider man teenager,the amazing spider-man
markaddy williamhurt scottgrimes ridleyscott action adventure drama history 1190s archer england king of england robin hood,robin hood
aidanturner adambrown jamesnesbitt peterjackson adventure fantasy dwarf elf lake town mountain sword and sorcery,the hobbit: the desolation of smaug
christopherlee evagreen kristinscottthomas chrisweitz adventure family fantasy children epic friend girl quest,the golden compass
leonardodicaprio katewinslet gloriastuart jamescameron drama romance artist love ship titanic wet,titanic
robertdowneyjr. scarlettjohansson chrisevans anthonyrusso action adventure sci-fi based on comic book knife marvel cinematic universe returning character killed off superhero,captain america: civil war
liamneeson alexanderskarsgård tadanobuasano peterberg action adventure sci-fi thriller box office flop hawaii naval oahu hawaii ship,battleship
brycedallashoward judygreer omarsy colintrevorrow action adventure sci-fi thriller dinosaur disaster film experiment gone wrong jurassic park velociraptor,jurassic world
j.k.simmons jamesfranco kirstendunst samraimi action adventure fantasy romance death doctor scientist super villain tentacle,spider-man 2
robertdowneyjr. jonfavreau doncheadle shaneblack action adventure sci-fi armor explosion human bomb missile attack terrorist,iron man 3
hughjackman kelseygrammer danielcudmore brettratner action adventure fantasy sci-fi thriller battle mutant outrage walking through a wall x men,x-men: the last stand
stevebuscemi tylerlabine seanhayes danscanlon adventure animation comedy family fantasy cheating fraternity monster singing in a car university,monsters university
glennmorshower kevindunn ramonrodriguez michaelbay action adventure sci-fi autobot decepticon machine sun symbol,transformers: revenge of the fallen
bingbingli sophiamyles kelseygrammer michaelbay action adventure sci-fi blockbuster bumblebee the character semi truck and trailer texas truck,transformers: age of extinction
emmastone andrewgarfield b.j.novak marcwebb action adventure fantasy sci-fi costumed hero death of girlfriend masked vigilante returning character killed off teenager,the amazing spider-man 2
joemantegna thomaskretschmann eddieizzard johnlasseter adventure animation comedy family sport best friend car race conspiracy gadget car spy,cars 2
ryanreynolds temueramorrison taikawaititi martincampbell action adventure sci-fi autopsy lantern planet ring test pilot,green lantern
tomhanks johnratzenberger donrickles leeunkrich adventure animation comedy family fantasy college day care escape teddy bear toy,toy story 3
christianbale brycedallashoward common mcg action adventure sci-fi death row future machine rescue skynet,terminator salvation
jasonstatham paulwalker vindiesel jameswan action crime thriller car falling off a cliff hospital revenge star died before release terrorist,furious 7
petercapaldi bradpitt mireilleenos marcforster action adventure horror sci-fi thriller chaos disease infection pandemic zombie,world war z
jenniferlawrence peterdinklage hughjackman bryansinger action adventure fantasy sci-fi thriller dystopia super strength supernatural power time paradox time travel,x-men: days of future past
benedictcumberbatch brucegreenwood noelclarke j.j.abrams action adventure sci-fi admiral captain manhunt mission space,star trek into darkness
eddiemarsan ewenbremner ralphbrown bryansinger adventure fantasy bean giant king no opening credits princess,jack the giant slayer
jakegyllenhaal richardcoyle reeceritchie mikenewell action adventure fantasy romance alamut dagger king persia princess,prince of persia: the sands of time
charliehunnam cliftoncollinsjr. larryjoecampbell guillermodeltoro action adventure sci-fi giant monster kaiju pilot portal robot,pacific rim
glennmorshower lesterspeight kevindunn michaelbay action adventure sci-fi autobot decepticon job interview moon spacecraft,transformers: dark of the moon
harrisonford raywinstone jimbroadbent stevenspielberg action adventure fantasy cult figure femme fatale indiana jones unsubtitled foreign language year 1957,indiana jones and the kingdom of the crystal skull
a.j.buckley jackmcgraw petersohn petersohn adventure animation comedy family fantasy apatosaurus asteroid dinosaur fear river,the good dinosaur
kellymacdonald johnratzenberger juliewalters markandrews adventure animation comedy family fantasy archery coming of age female warrior princess rebellious daughter,brave
sofiaboutella melissaroxburgh lydiawilson justinlin action adventure sci-fi thriller hatred sequel space opera star trek third part,star trek beyond
johnratzenberger fredwillard jeffgarlin andrewstanton adventure animation family sci-fi earth obesity plant robot soil,wall·e
tzima danaivey noémielenoir brettratner action comedy crime thriller ambassador assassination chinese french triad,rush hour 3
oliverplatt liamjames tommccarthy rolandemmerich action adventure sci-fi ark catastrophe geologist president writer,2012
robinwright colinfirth garyoldman robertzemeckis animation drama family fantasy charles dickens christmas christmas eve ghost scrooge,a christmas carol
channingtatum milakunis eddieredmayne lanawachowski action adventure sci-fi box office flop critically bashed planet earth space opera woman in bra and panties,jupiter ascending
jimbroadbent kiranshah shanerangi andrewadamson adventure family fantasy hide and seek lion magic professor snow,"the chronicles of narnia: the lion, the witch and the wardrobe"
jenniferlawrence michaelfassbender tyesheridan bryansinger action adventure sci-fi mutant superhero superhero team x men year 1983,x-men: apocalypse
christianbale heathledger morganfreeman christophernolan action crime drama thriller based on comic book dc comics psychopath star died before release urban setting,the dark knight
johnratzenberger delroylindo jessharnell petedocter adventure animation comedy family balloon house promise retirement skeleton,up
amypoehler rainnwilson stephencolbert robletterman action adventure animation comedy family sci-fi alien alien invasion alien space craft giant giantess,monsters vs. aliens
robertdowneyjr. jeffbridges jonfavreau jonfavreau action adventure sci-fi afghanistan billionaire inventor playboy u.s. air force,iron man
chloëgracemoretz christopherlee raywinstone martinscorsese adventure drama family mystery automaton mechanical railway station steampunk train,hugo
willsmith salmahayek bailing barrysonnenfeld action comedy sci-fi western buddy movie general inventor steampunk utah,wild wild west
jetli brendanfraser russellwong robcohen action adventure fantasy horror thriller army china emperor mummy shangri la,the mummy: tomb of the dragon emperor
willsmith robinatkindownes ikebarinholtz davidayer action adventure comedy sci-fi based on comic book critically bashed father daughter relationship reference to superman super villain,suicide squad
jimmybennett morganfreeman stevecarell tomshadyac comedy family fantasy ark change congressman depiction of god flood,evan almighty
tomcruise larapulver noahtaylor dougliman action adventure sci-fi alien combat dying repeatedly end of the world time loop,edge of tomorrow
jeannetripplehorn rickaviles zakesmokae kevinreynolds action adventure sci-fi thriller future sail sea smoker water,waterworld
josephgordon-levitt dennisquaid leohoward stephensommers action adventure sci-fi thriller cobra gi joe snake train warhead,g.i. joe: the rise of cobra
amypoehler mindykaling phyllissmith petedocter adventure animation comedy drama family fantasy anger joy memory running away sadness,inside out
robertdowneyjr. scarlettjohansson jonfavreau jonfavreau action adventure sci-fi hammer military monaco revenge tony stark,iron man 2
chrishemsworth kristenstewart samclaflin rupertsanders action adventure drama fantasy evil queen fairy tale magic queen snow white,snow white and the huntsman
angelinajoliepitt sharltocopley samriley robertstromberg action adventure family fantasy romance curse dark fantasy fairy king kingdom,maleficent
garyoldman judygreer kodismit-mcphee mattreeves action adventure drama sci-fi ape dam leader post apocalypse sequel,dawn of the planet of the apes
keanureeves cary-hiroyukitagawa jinakanishi carlrinsch action adventure drama fantasy box office flop ronin samurai shogun tournament,47 ronin
scarlettjohansson chrisevans hayleyatwell anthonyrusso action adventure sci-fi conspiracy heroism megalomaniac super soldier world domination,captain america: the winter soldier
jonhamm kathygriffin marykayplace mikemitchell adventure animation comedy family fantasy alternate world fairy tale parody female warrior ogre true love,shrek forever after
judygreer chrisbauer thomasrobinson bradbird action adventure family mystery sci-fi boy genius futuristic city inventor teenage girl time travel,tomorrowland
damonwayansjr. danielhenney abrahambenrubi donhall action adventure animation comedy drama family sci-fi high tech martial arts masked man robot superhero,big hero 6
jackmcbrayer sarahsilverman joelotruglio richmoore adventure animation comedy family sci-fi arcade candy glitch king medal,wreck-it ralph
tomhanks eddiedeezen peterscolari robertzemeckis adventure animation family fantasy boy christmas christmas eve north pole train,the polar express
vivicaa.fox selaward juddhirsch rolandemmerich action adventure sci-fi alien battle defense independence day mothership,independence day: resurgence
gerardbutler americaferrera craigferguson deandeblois adventure animation family fantasy dragon island training viking village,how to train your dragon
nickstahl m.c.gainey carolynhennesy jonathanmostow action sci-fi drifter exploding truck future machine skynet,terminator 3: rise of the machines
bradleycooper vindiesel djimonhounsou jamesgunn action adventure sci-fi bounty hunter outer space raccoon talking animal tree,guardians of the galaxy
matthewmcconaughey annehathaway mackenziefoy christophernolan adventure drama sci-fi black hole father daughter relationship saving the world space travel wormhole,interstellar
leonardodicaprio tomhardy josephgordon-levitt christophernolan action adventure sci-fi thriller ambiguous ending corporate espionage dream subconscious thief,inception
aidanturner adambrown jamesnesbitt peterjackson adventure fantasy dragon dwarf hobbit orc wizard,the hobbit: an unexpected journey
bradpitt jasonflemyng juliaormond davidfincher drama fantasy romance deformed baby diary lingerie slip older man younger woman relationship premature aging,the curious case of benjamin button
jenniferlawrence michaelfassbender oliverplatt matthewvaughn action adventure sci-fi cia cia agent mutant nuclear war professor,x-men: first class
jenniferlawrence philipseymourhoffman joshhutcherson francislawrence adventure sci-fi death of sister dystopia execution rebellion revolution,the hunger games: mockingjay - part 2
nicolascage omarbensonmiller robertcapron jonturteltaub action adventure family fantasy chosen one enchanted object love spell training,the sorcerer's apprentice
jimmybennett mikevogel andrebraugher wolfgangpetersen action adventure drama thriller cruise escape ocean passenger water,poseidon
johnnydepp alanrickman annehathaway jamesbobin adventure family fantasy clock dark fantasy mad hatter queen sequel,alice through the looking glass
justintimberlake ericidle ruperteverett chrismiller adventure animation comedy family fantasy disney spoof fairy tale prince princess tough guy,shrek the third
dominiccooper callumrennie ruthnegga duncanjones action adventure fantasy based on video game fictional language fictional war orc sword and sorcery,warcraft
j.k.simmons emiliaclarke mattsmith alantaylor action adventure sci-fi alternate timeline cyborg future robot time machine,terminator genisys
brucespence shanerangi laurabrent michaelapted adventure family fantasy dragon king mouse quest warrior,the chronicles of narnia: the voyage of the dawn treader
jennifergarner jaimeking mako michaelbay action drama history romance war air raid black smoke japanese military japanese navy sunday,pearl harbor
zackward michaelo'neill kevindunn michaelbay action adventure sci-fi alien contact autobot decepticon robot vs. robot teenage hero,transformers
anthonyhopkins angelinajoliepitt brianblessed oliverstone action adventure biography drama history romance war ancient greece conquest greek greek myth king,alexander
robertpattinson danielradcliffe fionashaw davidyates adventure family fantasy mystery battle magic school teacher wizard,harry potter and the order of the phoenix
robertpattinson danielradcliffe rupertgrint mikenewell adventure family fantasy mystery fire goblet magic tournament wizard,harry potter and the goblet of fire
willsmith charlizetheron eddiemarsan peterberg action drama bully comeuppance destruction prison superhero tough girl,hancock
willsmith alicebraga willowsmith francislawrence drama horror sci-fi new york city pandemic post apocalypse survivalist virus,i am legend
johnnydepp christopherlee davidkelly timburton adventure comedy family fantasy chocolate diminution miniaturization physical flexability ticket,charlie and the chocolate factory
janeanegarofalo johnratzenberger briandennehy bradbird animation comedy family fantasy chef food french rat restaurant,ratatouille
christianbale liamneeson morganfreeman christophernolan action adventure armored car gangster gotham mixed martial arts social decay,batman begins
berniemac jadapinkettsmith cedrictheentertainer ericdarnell action adventure animation comedy family africa madagascar new york city sequel zoo,madagascar: escape 2 africa
robinwilliams ramimalek stevecoogan shawnlevy adventure comedy family fantasy hdtv motorcycle museum security guard tyrannosaurus rex,night at the museum: battle of the smithsonian
hughjackman ryanreynolds dominicmonaghan gavinhood action adventure fantasy sci-fi thriller army civil war claw fight commando wolverine the character,x-men origins: wolverine
essiedavis collinchou nonagaye lanawachowski action sci-fi battle epic fight future machine,the matrix revolutions
joshgad mauricelamarche livvystubenrauch chrisbuck adventure animation comedy family fantasy musical magic sister love sister sister relationship snow snowman,frozen
stevebastoni danielbernhardt helmutbakaitis lanawachowski action sci-fi car motorcycle chase one against many oracle prophecy stylized violence,the matrix reloaded
chrishemsworth natalieportman anthonyhopkins alantaylor action adventure fantasy arrest portal thor warrior weapon,thor: the dark world
tomhardy charlizetheron zoëkravitz georgemiller action adventure sci-fi thriller australia desert escape on the run post apocalypse,mad max: fury road
tomhanks ayeletzurer arminmueller-stahl ronhoward mystery thriller conclave illuminati murder reference to bernini reference to raphael,angels & demons
chrishemsworth natalieportman anthonyhopkins kennethbranagh action adventure fantasy battle marvel cinematic universe scientist thor throne,thor
chloëgracemoretz diedrichbader jameslipton byronhoward adventure animation comedy drama family cat dog hamster new york city superpower,bolt
kelligarner pipermackenzieharris niecynash hoytyeatman action adventure animation comedy family fantasy sci-fi fbi director guinea pig household appliance secret agent talking mouse,g-force
liamneeson edgarramírez lilyjames jonathanliebesman action adventure fantasy ares hades titan underworld zeus,wrath of the titans
johnnydepp chloëgracemoretz christopherlee timburton comedy fantasy horror camera shot of feet cartoon on tv female stockinged feet female stockinged soles foot closeup,dark shadows
tomcruise jeremyrenner seanharris christophermcquarrie action adventure thriller capture computer hacker mission rogue agent spy,mission: impossible - rogue nation
anthonyhopkins simonmerrells artmalik joejohnston drama fantasy horror thriller asylum death full moon transformation werewolf,the wolfman
christophwaltz alexanderskarsgård caspercrump davidyates action adventure drama romance africa capture jungle male objectification tarzan,the legend of tarzan
matthewbroderick oprahwinfrey riptorn stevehickner adventure animation comedy family bee dream sequence egg scatological humor squashed bug,bee movie
angelinajoliepitt garyoldman mikebell jenniferyuhnelson action adventure animation comedy family china kung fu panda peacock tigress,kung fu panda 2
seychellegabriel noahringer aasifmandvi m.nightshyamalan action adventure family fantasy avatar fire kingdom tribe water,the last airbender
philipseymourhoffman tomcruise eddiemarsan j.j.abrams action adventure thriller arms dealer fictional government agency mission rescue vatican,mission: impossible iii
channingtatum jakeweber mattcraven rolandemmerich action drama thriller black u.s. president president secret service tour white house,white house down
elisabethharnois danfogler tomeverettscott simonwells action adventure animation comedy family sci-fi boy martian rescue robot sexism,mars needs moms
hughjackman katewinslet davidsuchet davidbowers adventure animation comedy family boat frog rat sewer toad,flushed away
tyburrell zachcallison karanbrar robminkoff adventure animation comedy family sci-fi dog father son relationship inventor talking dog time travel,mr. peabody & sherman
bradpitt orlandobloom julianglover wolfgangpetersen adventure greek mythology prince trojan troy,troy
jadapinkettsmith martinshort cedrictheentertainer ericdarnell adventure animation comedy family animal circus island name in title lemur penguin,madagascar 3: europe's most wanted
tobystephens colinsalmon rickyune leetamahori action adventure thriller catfight clinic colonel diamond patricide,die another day
brucewillis stevebuscemi willpatton michaelbay action adventure sci-fi thriller asteroid astronaut bomb meteorite outer space,armageddon
willsmith rosariodawson riptorn barrysonnenfeld action adventure comedy family fantasy mystery sci-fi alien lingerie lingerie model m.i.b. pug,men in black ii
robinwright anthonyhopkins sebastianroché robertzemeckis action adventure animation fantasy creature demon king reward warrior,beowulf
j.k.simmons angelinajoliepitt wayneknight alessandrocarloni action adventure animation comedy family china kung fu panda pig village,kung fu panda 3
tomcruise jeremyrenner michaelnyqvist bradbird action adventure thriller dubai kremlin race against time russian terrorist,mission: impossible - ghost protocol
hughjackman kamilmcfadden khamanigriffin peterramsey adventure animation family fantasy belief box office hit children new york city tooth,rise of the guardians
johnmichaelhiggins richardburgi davidherman deanparisot comedy crime animal abuse ceo heist suburb unemployment,fun with dick and jane
tomcruise tonygoldwyn chadlindberg edwardzwick action drama history war captain emperor honor japan samurai,the last samurai
chrishemsworth leonardnimoy brucegreenwood j.j.abrams action adventure sci-fi box office hit future lifted by the throat star trek vulcan,star trek
j.k.simmons jamesfranco kirstendunst samraimi action adventure fantasy romance evil goblin spider spider man superhero,spider-man
gerardbutler djimonhounsou americaferrera deandeblois action adventure animation comedy family fantasy dragon father son relationship husband wife relationship mother son relationship viking,how to train your dragon 2
gerardbutler elodieyung bryanbrown alexproyas action adventure fantasy ancient egypt egypt egyptian egyptian god egyptian goddess,gods of egypt
samshepard joemorton richardroxburgh robcohen action adventure sci-fi thriller artificial intelligence box office flop fighter jet navy pilot,stealth
mattfrewer billycrudup stephenmchattie zacksnyder action drama mystery sci-fi conspiracy cynicism false promise of the american dream male full frontal nudity male nudity,watchmen
jetli renerusso darlenelove richarddonner action crime thriller kung fu lapd martial arts private investigator triad,lethal weapon 4
kevinrankin regidavis celiaweston anglee action sci-fi 1980s c 130 hercules monster panzer san francisco california,hulk
channingtatum dwaynejohnson elodieyung jonm.chu action adventure sci-fi thriller general gi joe martial arts ninja president,g.i. joe: retaliation
stevebuscemi ming-nawen jeansimmons hironobusakaguchi action adventure animation fantasy romance sci-fi general military scientist soldier year 2065,final fantasy: the spirits within
chrisevans dominiccooper hayleyatwell joejohnston action adventure sci-fi arctic captain america scientist tesseract war bond,captain america: the first avenger
colinsalmon mariagraziacucinotta desmondllewelyn michaelapted action adventure thriller british oil scientist terrorist tycoon,the world is not enough
jamesd'arcy leeingleby davidthrelfall peterweir action adventure drama history war 1800s napoleonic wars pursuit royal navy ship,master and commander: the far side of the world
robinwilliams bradpitt common georgemiller animation comedy family musical 3d antarctica krill penguin sequel,happy feet 2
tyburrell petermensah williamhurt louisleterrier action adventure sci-fi antidote cure hulk marvel cinematic universe opening action scene,the incredible hulk
donjohnson philipmichaelthomas johndiehl unknown action crime drama mystery thriller cult tv detective drugs police undercover,miami vice            
markrylance penelopewilton rafespall stevenspielberg adventure family fantasy cannibal evil brother giant london england queen,the bfg
leonardodicaprio tomhardy lukashaas alejandrog.iñárritu adventure drama thriller western bear attack cauterizing a wound native american revenge survival,the revenant
ryanreynolds snoopdogg benschwartz davidsoren adventure animation comedy family sport accident freak accident race snail underdog,turbo
johnnydepp raywinstone stephenroot goreverbinski adventure animation comedy family western chameleon lizard sheriff water western town,rango
benedictcumberbatch annetmahendru andyrichter ericdarnell adventure animation comedy family little girl park spy statue of liberty television van,penguins of madagascar
mattdamon edgarramírez albertfinney paulgreengrass action mystery thriller action hero cia dark past flashback memory,the bourne ultimatum
angelinajoliepitt wayneknight danfogler markosborne action adventure animation comedy family kung fu kung fu master master panda snow leopard,kung fu panda
judygreer hayleyatwell t.i. peytonreed action adventure comedy sci-fi ant chinatown san francisco heist sabotage vault,ant-man
