tags,title
robertdowneyjr. riptorn richardthomas curtishanson comedy drama based on novel college girl midlife crisis pittsburgh pennsylvania professor,wonder boys
drakebell tracymorgan marionross craigmazin action comedy sci-fi thriller dragonfly hero high school soaking wet supervillian origin,superhero movie
alonatal jamesransone michaelbeach allenhughes crime drama thriller election father son relationship fellatio gay slur title spoken by character,broken city
shannonelizabeth portiaderossi derekmears wescraven comedy horror creature death party rescue werewolf,cursed
josephgordon-levitt daniaramirez aasifmandvi davidkoepp action crime thriller chase courier delivery envelope police,premium rush
jimgaffigan richardt.jones michaelmosley annefletcher action comedy crime danger drug cartel female cop female police officer fugitive,hot pursuit
djimonhounsou lucygordon alexjennings shekharkapur adventure drama romance war male nudity naked dead man nudity sex whipping,the four feathers
jasonstatham cliftoncollinsjr. wendellpierce taylorhackford action crime romance thriller action hero disguise hospital real estate agent thief,parker
kirstendunst jonfavreau austinnichols richardloncraine comedy romance sport career player tennis tennis player wimbledon,wimbledon
brendanfraser brookeshields mattprokop rogerkumble comedy family animal bear land developer real estate real estate developer,furry vengeance
alexrussell caribaheine richardbrancatisano kimblerendall action horror sci-fi great white shark shark supermarket swimming tsunami,bait
liamneeson alunarmstrong lysetteanthony peteryates action adventure fantasy cyclops fortress monster planet rescue,krull
merylstreep tomcruise andrewgarfield robertredford drama thriller war afghanistan professor reporter student university,lions for lambs
rosannaarquette dannflorek christopherrich johnmilius action drama thriller war bombardier pilot u.s. navy vietnam vietnam war,flight of the intruder
timmeadows natfaxon mattprice jakekasdan comedy music drugs elvis musician singer the beatles,walk hard: the dewey cox story
kevinspacey scottglenn jasonbehr lassehallström drama employee employer relationship husband wife relationship newspaper ship wake,the shipping news
gregorysmith ronnycox harrisyulin lesmayfield action western legend old west outlaw railroad stealing from the rich,american outlaws
michielhuisman jimbroadbent thomaskretschmann jean-marcvallée biography drama history romance 19th century courtship female protagonist princess queen of england,the young victoria
tomskerritt basharrahal shawndoyle dominicsena action crime mystery thriller antarctica geologist investigation u.s. marshal winter,whiteout
bradpitt tyesheridan fionashaw terrencemalick drama fantasy 1950s children ice cube texas waco texas,the tree of life
paulsorvino lelarochon raynicholas harktsui action comedy thriller cia hong kong market undercover van,knock off
heathledger markaddy bennofürmann brianhelgeland action mystery thriller death exorcism heaven priest sin eater,the order
juliebenz wayneknight colinsalmon lexialexander action crime drama thriller gun fu plastic surgery psychopath undercover vigilante,punisher: war zone
kevinzegers riptorn thomasf.wilson peterhewitt action adventure family sci-fi bruise female hero super strength superhero teenage superhero,zoom
josephgordon-levitt soleymanpierini jadekindar-martin robertzemeckis adventure biography drama thriller 1970s based on true story new york city skyscraper tightrope walker,the walk
marleyshelton leearenberg angusmacfadyen ronnyyu action adventure fantasy anthropomorphic animal football kangaroo sword and sorcery water boy,warriors of virtue
archiepanjabi albertfinney richardcoyle ridleyscott comedy drama romance based on novel inheritance provence uncle wine,a good year
ruthwilson indiravarma warrenbrown unknown crime drama mystery thriller murder police psychopath,luther            
adambaldwin thomasiannicholas johnheard richarddonner drama father son relationship physical abuse radio flyer stepfather stepfather stepson relationship,radio flyer
delroylindo jesseborrego raymondcruz taylorhackford crime drama 1970s 1980s barrio gang war mexican,"blood in, blood out"
jimbroadbent tomwilkinson juliaormond billeaugust action drama sci-fi thriller boy greenland neighbor roof snow,smilla's sense of snow
petercoyote gregghenry rierasmussen briandepalma crime drama mystery thriller ambassador cannes identity suicide thief,femme fatale
oliverreed rodsteiger johngielgud moustaphaakkad biography drama history war arab general libya muslim mussolini,lion of the desert
oliviermartinez françoiscluzet isabellecarré jean-paulrappeneau adventure drama romance war austrian breasts cholera police provence,the horseman on the roof
jeremyw.auman jeffreydover tobeymaguire anglee drama romance war western bushwhacker friend honor kansas raid,ride with the devil
maricelálvarez hanaabouchaib eduardfernández alejandrog.iñárritu drama children chinese illegal immigrant immigrant male ponytail,biutiful
salmahayek samshepard dwightyoakam joachimrønning action comedy crime western bank cleavage farmer female gunfighter mexico,bandidas
billcobbs aishatyler beverlyd'angelo tonykaye crime drama based on novel,black water transit
kihonglee amlameen jacoblatimore wesball action mystery sci-fi thriller based on novel concrete wall maze open ended teenage boy,the maze runner
tomwilkinson junedianeraphael melissamcmeekin kenscott comedy business trip company glory hole male frontal nudity male nudity,unfinished business
richarde.grant geraldinechaplin stuartwilson martinscorsese drama romance 19th century countess lawyer love new york,the age of innocence
hughjackman ellenburstyn markmargolis darrenaronofsky drama sci-fi eternity love mayan tree tree of life,the fountain
davidpaymer kevinj.o'connor hudsonleick hughjohnson action adventure comedy drama thriller colonel ice ice cream truck military u.s. army,chill factor
nicolascage markvalley samigayle simonwest action crime drama thriller bank money presumed dead rescue thief,stolen
rumihiiragi yûkiamami yurianara hayaomiyazaki adventure animation family fantasy children adventure magical realism sea goddess small town tsunami,ponyo
tiagoriani melissabenoist hayleylovitt georgetillmanjr. drama romance 1940s art collector bull riding north carolina student,the longest ride
liamaiken evamariesaint vincentperez hughhudson adventure drama romance dream italian kenya ranch snake,i dreamed of africa
gerardbutler dennisquaid judygreer gabrielemuccino comedy romance sport coach soccer soccer coach soccer mom soccer team,playing for keeps
terrypheto fanamokoena tonykgoroge justinchadwick biography drama history africa apartheid nelson mandela president resistance,mandela: long walk to freedom
paulsorvino warrenbeatty m.emmetwalsh warrenbeatty biography drama history romance cold war cold war era interview russia written and directed by cast member,reds
tomcruise demimoore kevinpollak robreiner drama thriller cuba guantanamo lance corporal lawyer murder,a few good men
michaeljaiwhite billduke brucemcgill andrzejbartkowiak action comedy crime drama thriller corrupt cop drug dealer drugs heroin vice president,exit wounds
nialong cedrictheentertainer tichinaarnold rajagosnell action comedy crime disguise fbi female impersonation gender disguise obesity,big momma's house
kylehebert briannebrozey joeochman jeremydegruson adventure animation comedy family fantasy,thunder and the house of magic
maxminghella veronikavernadskaya datobakhtadze chrisgorak action adventure horror sci-fi thriller alien aurora borealis critically bashed killing an animal nightclub,the darkest hour
ryanguzman stephenboss mishagabrielhamilton scottspeer drama music romance 3 dimensional dance dancer dancing flash mob,step up revolution
keanureeves josephsikora chrisellis joecharbanic crime horror mystery thriller fbi murder scene of the crime serial killer therapy,the watcher
lauraharring marcost.john eddiejemison jonathanhensleigh action crime drama thriller death family reunion fbi fbi agent vigilante,the punisher
seanpertwee kunobecker stephendillane dannycannon drama romance sport barrio border newcastle united party soccer,goal! the dream begins
jasonstatham reggielee robertjohnburke boazyakin action crime thriller bodyguard gang war russian russian mafia triad,safe
angelinajoliepitt kurtfuller jakeweber mikenewell comedy drama romance air traffic control air traffic controller female bodybuilder job marriage,pushing tin
harrisonford ianmcdiarmid kennybaker richardmarquand action adventure fantasy sci-fi death star emperor empire princess rebel,star wars: episode vi - return of the jedi
ryankruger jasoncope jeremycrutchley neilmarshall action sci-fi thriller cure quarantine scotland virus wall,doomsday
katewinslet davidkross susannelothar stephendaldry drama romance love reading teaching oneself to read trial war crime,the reader
justintheroux laurenambrose joelotruglio davidwain comedy childbirth female frontal nudity nude protest nudist skinny dipping,wanderlust
peterdinklage zooeydeschanel willferrell jonfavreau comedy family fantasy romance baby christmas spirit elf new york city north pole,elf
robertduvall kyrasedgwick davidgallagher jonturteltaub drama fantasy romance sci-fi brain tumor genius psionic power telekinesis terminal illness,phenomenon
jamescoburn nichellenichols m.emmetwalsh brianlevant adventure comedy family sport dentist dog inheritance race sled dog,snow dogs
billmurray alfrewoodard robertmitchum richarddonner comedy drama fantasy christmas compassion executive ghost redemption,scrooged
anadelareguera moisesarias héctorjiménez jaredhess comedy family sport lucha libre monastery nun orphan wrestling,nacho libre
mattlucas wendimclendon-covey stevebannos paulfeig comedy romance best friend failure food job partial female nudity,bridesmaids
channingtatum jamesfranco emmawatson evangoldberg comedy fantasy apocalypse celebrity ensemble cast party rapture,this is the end
nialong enricocolantoni portiaderossi rupertwainwright horror catholic priest stigmata vatican wound,stigmata
robertdeniro charlizetheron michaelrapaport georgetillmanjr. biography drama african american amputee navy racial discrimination racism,men of honor
paulwalker haydenchristensen jayhernandez johnluessenhop action crime thriller armored car bank falling out among thieves heist planning,takers
robinwilliams robertdeniro tophergrace justinzackham comedy adoption divorce family relationships farce wedding,the big wedding
brandont.jackson tonycurran portiadoubleday johnwhitesell action comedy crime fbi agent murder performing arts school scene during end credits undercover,"big mommas: like father, like son"
jakegyllenhaal casanvar russellpeters duncanjones mystery sci-fi thriller bomber time time loop train trapped in a time loop,source code
illeanadouglas dannynucci michaeldelorenzo frankmarshall adventure biography drama thriller andes mountains crash death starvation stranded,alive
loganlerman virginiamadsen edlauter joelschumacher mystery thriller destiny detective imagination murder sex scene,the number 23
callumrennie julianrichings judydavis jean-pierrejeunet action adventure drama family 3 dimensional cartographer punctuation in title smithsonian train,the young and prodigious t.s. spivet
christopherlee johnbelushi treatwilliams stevenspielberg action comedy war california captain cult film pearl harbor submarine,1941
kenhoward freddyrodríguez holmesosborne johngatins drama family sport colon in title horse kentucky overalls six word title,dreamer: inspired by a true story
viggomortensen kyleschmid williamhurt davidcronenberg crime drama thriller bar crotch shot female full frontal nudity female pubic hair robbery,a history of violence
jasonstatham jasonflemyng matthewmodine louisleterrier action crime thriller driver french kidnapping police sequel,transporter 2
leonardodicaprio pathingle robertsblossom samraimi action thriller western authority figure as villian gun duel saved from hanging showdown street shootout,the quick and the dead
francesfisher mikedoyle noradunn peterhowitt comedy romance date divorce divorce lawyer drinking lawyer,laws of attraction
nicolascage marcanthony sonjasohn martinscorsese drama thriller ambulance ghost hell paramedic rescue,bringing out the dead
alicebraga rza yvettenicolebrown miguelsapochnik action crime sci-fi thriller artificial organ best friend enforcer future near future,repo men
robertforster aimeegarcia chrismulkey hyung-raeshim action drama fantasy horror thriller antique shop asian dragon dragon korean reporter,dragon wars: d-war
haleyjoelosment nancytravis andreamartin normanjewison comedy family fantasy box office flop circus imaginary friend magician one word title,bogus
stevebuscemi oliviawilde stevecarell donscardino comedy magic magic kit magician stage magician vegas,the incredible burt wonderstone
georgekennedy frankwelker halholbrook markdindal animation comedy family fantasy musical animal cat child star hollywood star,cats don't dance
billmurray vanessaredgrave emilywatson timrobbins drama 1930s depression play theatre union,cradle will rock
tonycurran beaubridges lelandorser stevensoderbergh drama mystery thriller american driver journalist russian secret,the good german
joanplowright rolloweeks simoncallow tomreeve action adventure comedy fantasy romance dragon knight love priest princess,george and the dragon
harrisonford marlonbrando robertduvall francisfordcoppola drama war army green beret insanity jungle vietnam,apocalypse now
robriggle kelligarner jimgaffigan nanetteburstein comedy romance bar job long distance relationship male pubic hair pubic hair,going the distance
aliciawitt olympiadukakis jeanlouisakelly stephenherek drama music 1990s high school high school teacher teacher inspires students teaching,mr. holland's opus
garyoldman jordimollà dougcockle arielvromen action crime drama mystery sci-fi thriller cia husband wife relationship memory tied up while barefoot violence,criminal
merylstreep michaelgough michaelkitchen sydneypollack biography drama romance africa hunter love marriage plantation,out of africa
denzelwashington brucegreenwood nadinevelazquez robertzemeckis drama thriller airline flight flight attendant lawyer pilot,flight
desmondllewelyn loischiles loismaxwell lewisgilbert action adventure sci-fi thriller astronaut dog official james bond series space shuttle space shuttle transported on a 747,moonraker
billmurray tomwilkinson f.murrayabraham wesanderson adventure comedy crime drama first person narration hotel lobby boy mentor protege relationship painting,the grand budapest hotel
anthonyhopkins mikaboorem hopedavis scotthicks drama mystery based on multiple works bully kiss memory mysterious stranger,hearts in atlantis
juliansands peterjason brianmcnamara frankmarshall comedy fantasy horror thriller arachnophobia death doctor small town spider,arachnophobia
dennisquaid andrebraugher noahemmerich gregoryhoblit crime drama mystery sci-fi thriller altering history alternate history amateur radio ham radio paranormal phenomena,frequency
edbegleyjr. katemckinnon zachwoods paulfeig action comedy fantasy sci-fi ghost ghostbuster ghostbusters male objectification reboot,ghostbusters
chrishemsworth normanreedus beverlyd'angelo johnfrancisdaley adventure comedy amusement park dysfunctional family road trip sequel vacation,vacation
delroylindo renerusso jongries barrysonnenfeld comedy crime thriller debt loan shark mobster movie business producer,get shorty
colmfeore chitarivera jayneeastwood robmarshall comedy crime musical fame jail jazz age murder vaudeville,chicago
stevebuscemi adamsandler joeylaurenadams dennisdugan comedy drama homosexual law law school responsibility vomiting,big daddy
alysonhannigan shannonelizabeth natashalyonne j.b.rogers comedy beach beach house college party student,american pie 2
tomhanks johnratzenberger jimvarney johnlasseter adventure animation comedy family fantasy claw crane cowboy jealousy rivalry toy,toy story
keanureeves alanruck joemorton jandebont action adventure crime thriller bomb bus elevator explosive rescue,speed
channingtatum lucasbryant dilloncasey michaelsucsy drama romance car accident life support memory loss trauma voice recording,the vow
harrisonford brendanfraser alanruck tomvaughan drama cure disease imagination race against time venture capital,extraordinary measures
ryangosling denzelwashington ethansuplee boazyakin biography drama sport american football based on true story head coach high school school,remember the titans
scottglenn jeffreyjones courtneyb.vance johnmctiernan action adventure thriller analyst defection navy soviet submarine submarine,the hunt for red october
alexpettyfer davidoyelowo vanessaredgrave leedaniels biography drama butler civil rights hotel president white house,lee daniels' the butler
anjelicahuston rauljulia carelstruycken barrysonnenfeld comedy fantasy accountant loan shark macabre uncle uncle fester,the addams family
brucespence bobgunton sophieokonedo steveoedekerk adventure comedy africa bat hawaiian shirt pregnancy pregnant,ace ventura: when nature calls
annehathaway hectorelizondo heathermatarazzo garrymarshall comedy family romance cinderella story fish out of water makeover manners princess,the princess diaries
stockardchanning elizabethberkley stephencollins hughwilson comedy cult film female therapist revenge revenge motive therapy session,the first wives club
morganfreeman bradpitt rege.cathey davidfincher crime drama mystery thriller detective police partner serial killer serial murder seven deadly sins,se7en
sharltocopley jedbrophy jasoncope neillblomkamp action sci-fi thriller alien ghetto prawn refugee refugee camp,district 9
scarlettjohansson billfagerbakke rodgerbumpass stephenhillenburg adventure animation comedy family fantasy based on tv series crown dream king neptune plankton,the spongebob squarepants movie
johndoman spencertreatclark tomguiry clinteastwood crime drama mystery thriller ballistics detective friend gun sexual abuse,mystic river
clinteastwood morganfreeman mikecolter clinteastwood drama sport boxing boxing trainer death suicide attempt women boxing,million dollar baby
robertdeniro chazzpalminteri mollyshannon haroldramis comedy crime analyst mafia patient psychiatrist wedding,analyze this
ryangosling kevinconnolly genarowlands nickcassavetes drama romance class differences letter nursing home second chance summer love,the notebook
judygreer berncohen yettagottesman annefletcher comedy romance boss bridesmaid friend love wedding,27 dresses
emilyosment vanessawilliams moisesarias peterchelsom comedy drama family music romance farm female protagonist hannah montana horseback riding overalls,hannah montana: the movie
elizabethdaily caseykasem debbiereynolds stigbergqvist adventure animation comedy family romance amusement park baby france paris france villain,rugrats in paris: the movie
georgecarlin blythedanner melindadillon barbrastreisand drama romance new york psychiatrist shrimper south carolina twins,the prince of tides
anthonyhopkins bradpitt juliaormond edwardzwick drama romance war western epic heart killing an animal passion usa,legends of the fall
j.k.simmons annakendrick chrislowell jasonreitman drama romance airport business trip downsizing on the road travel,up in the air
hopedavis junesquibb howardhesseman alexanderpayne comedy drama highway travel on the road retirement road movie wedding,about schmidt
coryhardrict vincentleclerc danielrindress-kay jonathanlevine comedy horror romance fight memory teenager undead zombie,warm bodies
josephgordon-levitt brucewillis traciethoms rianjohnson action crime drama sci-fi thriller chase future surprise ending time loop time travel,looper
chazzpalminteri markaddy wandasykes chrisweitz comedy fantasy angel butler heaven manhattan new york city reincarnation,down to earth
miriammargolyes christinecavanaugh roscoeleebrowne chrisnoonan comedy drama family dog farmer pig sheep sheepdog,babe
merylstreep stevecarell jeansmart davidfrankel comedy drama romance couple intimacy marriage marriage counseling middle age couple,hope springs
milakunis jackmcbrayer mariathayer nicholasstoller comedy drama romance breakup hawaii hotel male full frontal nudity resort,forgetting sarah marshall
zachgilford aimeeteegarden scottporter unknown drama sport football football coach high school small town texas,friday night lights            
joshcharles tonynappo fionnulaflanagan johnsingleton action crime drama mystery thriller bare butt corrupt police four brothers funeral murder,four brothers
tinafey amypoehler romanymalco michaelmccullers comedy romance baby book cartoon on tv female protagonist male anorexia,baby mama
billcobbs harryconnickjr. genarowlands forestwhitaker drama romance best friend friend mother daughter relationship small town texas,hope floats
annehathaway stevehowey candicebergen garywinick comedy romance best friend dyed hair fake tan rivalry wedding,bride wars
antonystarr scottadsit bonniesomerville stevenbrill adventure comedy mystery death friend hijacker river tree house,without a paddle
jennifergarner judygreer christab.allen garywinick comedy fantasy romance 13 year old 13th birthday 30 year old wish year 1987,13 going on 30
kurtfuller audreyfleurot ninaarianda woodyallen comedy fantasy romance 1920s golden age midnight paris france time travel romance,midnight in paris
liamneeson brendanfraser sarahgadon peterlepeniotis adventure animation comedy family bank robbery heist raccoon rat squirrel,the nut job
johnnydepp ethansuplee jordimollà teddemme biography crime drama 1960s 1970s california cocaine wealth,blow
robinwright johnsavage raphaelsbarge luismandoki drama romance beach bottle jogging letter love,message in a bottle
leonardnimoy nichellenichols walterkoenig williamshatner action adventure sci-fi thriller captain half brother klingon planet vulcan,star trek v: the final frontier
brendasong robertforster annemeara johnschultz comedy family fantasy sport basketball lightning nba orphanage shoe,like mike
georgekennedy fredward priscillapresley petersegal comedy crime retirement spoof terrorist transsexual undercover,naked gun 33 1/3: the final insult
patrickmacnee alisondoody tanyaroberts johnglen action adventure thriller computer earthquake microchip official james bond series silicon valley,a view to a kill
markgatiss geraldinemcewan petersallis stevebox animation comedy family mystery sci-fi competition giant vegetable pest control stop motion animation vegetable,the curse of the were-rabbit
gerardbutler harryconnickjr. nelliemckay richardlagravenese drama romance birthday friendship hairy chest letter widow,p.s. i love you
brucegreenwood frankiemuniz m.emmetwalsh frederikduchau adventure comedy drama family sport farm horse kentucky racehorse zebra,racing stripes
benedictcumberbatch alfieallen brendablethyn joewright drama mystery romance war death of sister dying loss of virginity septicemia sex,atonement
vanessaredgrave marciadebonis luisaranieri garywinick comedy drama romance chick flick female protagonist italian stereotype man in a swimsuit verona italy,letters to juliet
stephenroot kentakakura katecapshaw ridleyscott action crime thriller counterfeit detective japan police chase yakuza,black rain
kateupton larrydavid seanhayes bobbyfarrelly comedy mule nun orphanage tennis court the three stooges,the three stooges
johnnydepp christopherlee joannalumley timburton animation drama family fantasy musical romance arranged marriage bride corpse groom woods,corpse bride
mehcadbrooks austinnichols derekluke jamesgartner biography drama sport coach college basketball national championship ncaa texas,glory road
edgararreola bernardosaracino danielkaluuya denisvilleneuve action crime drama mystery thriller critically acclaimed drug cartel juarez mexico u.s. mexico border war on drugs,sicario
jakegyllenhaal 50cent oonalaurence antoinefuqua drama sport boxer boxing training death of wife male in shower rage,southpaw
bojananovakovic alisonlohman reggielee samraimi horror thriller evil fight hell psychic psychologist,drag me to hell
harrisonford michielhuisman ellenburstyn leetolandkrieger drama fantasy romance hit by a pickup truck immortality paramedic resuscitation san francisco california,the age of adaline
haleyjoelosment robertduvall emmanuellevaugier timmccanlies comedy drama family africa eyeglasses money texas veteran,secondhand lions
alysonstoner stephenboss facundolombard jonm.chu drama music romance dance dance crew dancer mortgage new york city,step up 3d
faizonlove mikaboorem sanoelake johnstockwell drama romance sport bikini female surfer sister sister relationship surfing contest swimsuit,blue crush
willferrell christianstolte dannyrhodes marcforster comedy drama fantasy romance author fate novelist professor writer,stranger than fiction
dannyhuston markrendall meganfranich davidslade horror alaska small town snow vampire winter,30 days of night
chrishemsworth bradleywhitford kristenconnolly drewgoddard fantasy horror mystery thriller cabin in the woods dark humor hatchet killed in an elevator robot,the cabin in the woods
carmenelectra diedrichbader methodman jasonfriedberg comedy king persian spartan training xerxes,meet the spartans
robertdeniro yaphetkotto philipbakerhall martinbrest action comedy crime thriller accountant bounty hunter fbi mafia mob,midnight run
yaphetkotto mariaconchitaalonso richarddawson paulmichaelglaser action crime sci-fi thriller game of death government conspiracy latina oppression police,the running man
billmurray jimbelushi tishacampbell-martin frankoz comedy horror musical sci-fi eclipse florist nerd plant shop,little shop of horrors
