tags,title
cchpounder jadapinkettsmith garyfarmer ernestr.dickerson action fantasy horror thriller blood blood of christ demon key loud sex,tales from the crypt: demon knight
noelfisher ambervalletta larrymiller timhill comedy crime family bully moving principal revenge school,max keeble's big move
charlizetheron pattonoswalt collettewolfe jasonreitman comedy drama car damage computer printer female band fingernail polish narcissism,young adult
jasonstatham edigathegi josepablocantillo markneveldine action crime thriller assassin cult film doctor heart poison,crank
berniemac gilbertgottfried larkvoorhies lionelc.martin comedy breaking the fourth wall doorman friend party sex,how to be a player
hollyhunter eddiecibrian jenettegoldstein richardlagravenese comedy drama romance brooklyn bridge divorce female protagonist female star appears nude lingerie slip,living out loud
common lazalonso mehcadbrooks sanaahamri comedy romance sport basketball basketball player nba physical therapist therapist,just wright
annehathaway rosemariedewitt billirwin jonathandemme drama romance 12 step program friend maid of honor tears wedding,rachel getting married
anjelicahuston michaellerner johncolicos bobrafelson crime drama romance thriller adultery drifter lunch wagon murder neo noir,the postman always rings twice
scarlettjohansson colinfirth tomwilkinson peterwebber biography drama romance 17th century girl maid painter painting,girl with a pearl earring
jürgenprochnow martinsemmelrogge herbertgrönemeyer wolfgangpetersen adventure drama thriller war duty submarine submarine movie tension u boat,das boot
dennisquaid marcblucas jordimollà johnleehancock drama history war western army dictator general texan texas,the alamo
heathermatarazzo barrywatson harlandwilliams wallacewolodarsky comedy college cruise drag female armpit hair sorority,sorority boys
tomhughes tomhollander lindsayduncan richardcurtis drama fantasy romance boyfriend girlfriend relationship lingerie slip time travel time travel romance wedding,about time
takeshikaneshiro andylau zhengyongzhang yimouzhang action adventure drama romance flying flying dagger government police secret,house of flying daggers
nateparker curtisscook rege.cathey nicholasjarecki drama thriller accidental death dead woman dead woman with eyes open death of mistress manager,arbitrage
garyweeks jonnyweston sofiablack-d'elia deanisraelite sci-fi thriller found footage teenager time machine time travel video footage,project almanac
cedrictheentertainer veronikadash tammyblanchard darnellmartin biography drama music 1950s jazz jazz music sex title directed by female,cadillac records
sarahsilverman davechappelle shermanhemsley scottalexander comedy crime chauffeur disorganized crime dog ransom slapstick,screwed
christopherlambert kurtwoodsmith cliftoncollinsjr. stuartgordon action crime sci-fi thriller escape future population control prison prisoner,fortress
johnmichaelhiggins catherineo'hara edbegleyjr. christopherguest comedy actor internet make up publicist purim,for your consideration
melaniegriffith aleksapalladino gregmottola woodyallen comedy drama celebrity journalist lesbian kiss strong female character tv producer,celebrity
jillclayburgh josephcross dagmaradominczyk ryanmurphy comedy drama alcoholic fame therapist writer writing,running with scissors
anikanonirose kellyclarkson briandietzen robertiscove comedy musical romance bar florida love spring break waitress,from justin to kelly
michaelimperioli debimazar gretchenmol spikelee comedy drama actress neighbor phone sex queens new york city sex addiction,girl 6
jenniferjasonleigh nickdamici susangardner janecampion mystery thriller blow job female rear nudity female removes her clothes oral sex three of spades tattoo,in the cut
isabellarossellini vinessashaw samanthaivers jamesgray drama romance jewish love married man neighbor photograph,two lovers
bobhoskins raywinstone jjfeild fredschepisi drama ashes butcher friend friendship memory,last orders
doonabae kang-hosong ah-sungko joon-hobong comedy drama horror sci-fi daughter han river monster river seoul,the host
robertduvall treatwilliams paulgleason rogerspottiswoode adventure crime thriller escape jumping from an airplane money parachute ransom,the pursuit of d.b. cooper
jeremydavies jeffreyjones davidarquette antoniabird fantasy horror thriller based on true story cannibalism captain mexican american war u.s. frontier,ravenous
robertdowneyjr. meganpark hopedavis jonpoll comedy drama romance drugs high school prescription drugs private school student,charlie bartlett
toniservillo sabrinaferilli serenagrandi paolosorrentino drama genitalia male frontal nudity male nudity old age party,the great beauty
kieranculkin michaelharding jakerichardson petercare comedy drama book boy catholic comic book friend,the dangerous lives of altar boys
miawasikowska aldenehrenreich harmonykorine chan-wookpark drama thriller death hitchcockian psychopath sociopath vomiting,stoker
ligong tonychiuwaileung maggiecheung kar-waiwong drama romance sci-fi number in title train woman slaps a man woman slaps man written by director,2046
davidrichmond-peck erinboyes timothywebber irasachs crime drama romance bachelor best friend divorce poison widow,married life
eamonnwalker hopedavis campbellscott carrollballard adventure drama family africa bed boy cheetah south africa,duma
tonycurran stephenrea alicjabachleda neiljordan drama mystery romance celtic mythology cottage fisherman irish selkie,ondine
omarepps tatyanaali jamesshigeta takeshikitano crime drama thriller gang gangster subjective camera written and directed by cast member yakuza,brother
michaeljeter isaiahwashington andydavoli anthonyrusso comedy crime boxing knockout heist implied sex keys prison,welcome to collinwood
kyrasedgwick annebancroft albertbrooks sidneylumet comedy drama half sister hospital latex gloves medicine nun,critical care
evaamurrimartino lynncohen brettcullen vadimperelman drama mystery thriller best friend nonlinear timeline school shooting self sacrifice shooting,the life before her eyes
diannewiest markduplass samshepard lawrencekasdan comedy drama romance dog marriage search wedding woods,darling companion
zackward katedelcastillo alicjabachleda marcokreuzpaintner crime drama thriller friend girl mexico city new jersey sex,trade
marcellnagy péterfancsikai bálintpéntek lajoskoltai drama romance war bus death gay slur hatred jewish,fateless
brucewillis albertfinney omarepps alanrudolph comedy breakfast manitoba sci-fi writer suicide writer,breakfast of champions
davidhewlett jeremynortham karimatchett vincenzonatali mystery romance sci-fi thriller brainwashing corporate espionage spy suburb surprise ending,cypher
yeliu yuanyuangao ryukohata chuanlu drama history war atrocity battle chinese horseback riding martial arts,city of life and death
jonheder tomarnold rebeccablack lijunsun action adventure animation comedy family anthropomorphic animal china furry rabbit,legend of kung fu rabbit
takuyakimura meisakuroki hiroyukiikeuchi takashiyamazaki action adventure drama sci-fi alien battleship message radiation yamato,space battleship yamato
richardcoyle kennethcranham anaimnadze rennyharlin action drama war cameraman epic battle journalist south ossetia street shootout,5 days of war
rachaelcarpani michaeldorman emmalung christophersmith fantasy mystery thriller deja vu lost at sea ship time loop trapped in a time loop,triangle
christopherlambert kellylebrock alexandracallas timothyhines drama,10 days in a madhouse
jacobvargas connorcorum robmoran randallwallace biography drama based on true story christ christian near death experience pastor,heaven is for real
garydaniels mattmarr gingerjensen davidwinters family musical,dancin' it's on
mikohughes fredgwynne denisecrosby marylambert fantasy horror cat cemetery maine secret woods,pet sematary
tatsuomatsumura tetsuwatanabe akiraterao akirakurosawa drama air raid beer birthday japan professor,madadayo
paddyconsidine carolinedhavernas charlottesullivan jamiethraves drama thriller isolated house promotion river small town stalking,the cry of the owl
weitang chingwanlau hailuqin mabelcheung drama,a tale of three cities
phoebecates harrycareyjr. zachgalligan joedante comedy fantasy horror bright light midnight pet small town water,gremlins
harrisonford petercushing kennybaker georgelucas action adventure fantasy sci-fi death star empire galactic war princess rebellion,star wars: episode iv - a new hope
robertdeniro zoeydeutch jasonmantzoukas danmazer comedy female removes her clothes fondling voyeur voyeurism white panties,dirty grandpa
juliechristie klauskinski geraldinechaplin davidlean drama romance war bolshevik poet poetry russia russian revolution,doctor zhivago
wagnermoura seltonmello danielzettel stephendaldry adventure crime drama mystery thriller bible key poverty slum wallet,trash
lucasgrabeel mattprokop corbinbleu kennyortega comedy drama family music musical romance basketball curtain call graduation high school high school senior,high school musical 3: senior year
christianbale jackmcgee melissamcmeekin davido.russell biography drama sport boxer boxing boxing match crack cocaine lowell massachusetts,the fighter
bammargera steve-o chrispontius jefftremaine action comedy documentary blindfold male frontal nudity male rear nudity pubic hair vomiting,jackass number two
fredgwynne brucemcgill lanesmith jonathanlynn comedy crime alabama jail judicial system lawyer trial,my cousin vinny
chloëgracemoretz mireilleenos stacykeach r.j.cutler drama fantasy music romance car accident coma out of body experience reference to the exploited teenage girl,if i stay
zoeventoura damiengarvey christophersommers briantrenchard-smith action comedy crime,drive hard
corbinbernsen tomberenger renerusso davids.ward comedy sport cleveland indians league manager owner team,major league
lilycole ruperteverett tamsinegerton oliverparker comedy 2000s female protagonist reward school st trinian's,st. trinian's
radhamitchell johnenosiii richardt.jones joelschumacher crime thriller phone booth publicist single set production sniper sniper rifle,phone booth
laurengerman petercoyote pazdelahuerta adamshankman drama romance community service love punishment school student,a walk to remember
loissmith celiaweston robertprosky timrobbins crime drama death execution nun solitary confinement visit,dead man walking
sarahmichellegellar seanpatrickthomas ericmabius rogerkumble drama romance bet revenge seduction virgin wager,cruel intentions
costasmandylor shawneesmith georgenewbern kevingreutert horror mystery deception flash photography game of death jigsaw pig mask,saw vi
nateparker aliciakeys jenniferhudson ginaprince-bythewood drama beekeeping insect in title racism sister south carolina,the secret life of bees
vincentpastore vinessashaw peterberg robpritts comedy crime fbi mafia mobster undercover veterinarian,corky romano
stevenbauer gabriellecarteris gregghenry briandepalma crime drama thriller hitchcockian long tracking shot psychologist psychology wig,raising cain
sylvesterstallone peterboyle rodsteiger normanjewison drama 1930s driving through a gate funeral senator trade union,f.i.s.t.
louisefletcher budcort williambassett tobehooper horror sci-fi alien boy nurse school school nurse,invaders from mars
juliewalters fionaglascott evabirthistle johncrowley drama romance 1950s immigrant irish irish accent torn between two worlds,brooklyn
ryano'neal stevenberkoff hardykrüger stanleykubrick adventure drama history war 18th century england rise and fall rural setting wealth,barry lyndon
leemajors jasonlondon thomaslennon brendanmalloy comedy sport alaska mountain ski resort snowboard snowboarding,out cold
willferrell johnwitherspoon timmeadows reginaldhudlin comedy black pantyhose female stockinged legs pantyhose radio tattoo,the ladies man
lukenewberry sheridansmith paulinecollins dustinhoffman comedy drama divorced couple opera reference to giuseppe verdi retirement senility,quartet
shannonelizabeth jakebusey davidogdenstiers gregorypoirier comedy box office flop critically bashed dominatrix friend money,tomcats
matthewmcconaughey powersboothe matto'leary billpaxton crime drama thriller demon fbi fbi agent murder religious fanatic,frailty
ryanreynolds francesfisher elizabethmcgovern simoncurtis biography drama history art jewish justice nazi theft,woman in gold
liamneeson oliverplatt dylanbaker billcondon biography drama professor research sex sexuality student,kinsey
patriciatallman bridgetfonda embethdavidtz samraimi comedy fantasy horror army of the dead battle necronomicon reluctant hero skeleton soldier,army of darkness
jaimeking geddewatanabe jimrash deweynicks comedy romance blackmail fall love nerd scam,slackers
johnnydepp leonardodicaprio kevintighe lassehallström drama romance apostrophe in title face slap four word title grocery store police,what's eating gilbert grape
henryiancusick alanvansprang scotthandy philipsaville biography drama history 1st century based on the bible miracle religion resurrection,the visual bible: the gospel of john
eddiemarsan sallyhawkins imeldastaunton mikeleigh crime drama 1950s miscarriage neighbor pregnancy tailor,vera drake
michaelmckean dashmihok jimimistry daisyvonscherlermayer comedy music romance bollywood illegal immigrant live television restaurant waiter,the guru
anjelicahuston chazzpalminteri vincentgallo miranair comedy drama romance immigration love political prisoner reference to john wayne title directed by female,the perez family
justintimberlake maxcasella alexkarpovsky ethancoen drama music 1960s car hitting an animal folk singer friend singer,inside llewyn davis
millajovovich waynepygram lisapelikan williama.graham adventure drama romance baby desert island island sequel teenage girl,return to the blue lagoon
frankfinlay anthonyzerbe samanthaeggar martinritt drama history coal detective irish irish immigrant pennsylvania,the molly maguires
katewinslet stevebuscemi eddieizzard johnturturro comedy musical romance anal sex death dream poem sex,romance & cigarettes
phyllidalaw davidkennedy angusbarnett agnieszkaholland biography drama music music copyist music student musical composition student symphony,copying beethoven
heathero'rourke zeldarubinstein craigt.nelson tobehooper fantasy horror ghost haunted haunting house paranormal investigator,poltergeist
samriley seanharris geoffbell rowanjoffe crime drama thriller brighton catholic gang prayer waitress,brighton rock
juliebenz costasmandylor scottpatterson davidhackl horror mystery blood splatter jigsaw nazi serial killer swastika tattoo,saw v
johncassavetes genarowlands brittekland giulianomontaldo crime drama thriller casino gang violence robbery suicide violence,machine gun mccain
noradunn linaesco alixfreihage lisaazuelos comedy drama romance best friend girl in panties high school high school romance pink panties,lol
johnhoward deborra-leefurness maxcullen raylawrence crime drama mystery thriller camp fishing fishing trip river town,jindabyne
shahrukhkhan johnabraham preityzinta karanjohar drama extramarital affair fashion magazine editor marriage new york teacher,kabhi alvida naa kehna
minniedriver ruperteverett jeremynortham oliverparker comedy romance bachelor blackmail character says i love you flirting social satire,an ideal husband
romolagarai oliviawilliams tomcullen ruairirobinson horror sci-fi thriller alien infection astronaut mars mission zombie,the last days on mars
lenaolin giancarlogiannini francescpagès jaumebalagueró horror 9 year old blood gramophone house missing children,darkness
keirdullea garylockwood glennbeck stanleykubrick adventure mystery sci-fi ancient astronaut famous line message from outer space monolith star child,2001: a space odyssey
henrythomas deewallace petercoyote stevenspielberg family sci-fi bicyclist boy doll star wars reference voice impersonation,e.t. the extra-terrestrial
kristenstewart elenaanaya dustinmilligan jonkasdan comedy drama romance actress love michigan neighbor writer,in the land of women
williamhurt marcdonato raoulmaxtrujillo léapool adventure drama butterfly entomologist morpho butterfly rain rain forest,the blue butterfly
rickyschroder kelliwilliams seymourcassel floydmutrux comedy drama high school love police showdown surfer,there goes my baby
antoniathomas johnnyflynn hannahbritland unknown comedy blond boy chlamydia list male rear nudity young couple,lovesick            
arjunrampal bomanirani riteishdeshmukh sajidkhan comedy bad luck casino lie mix up stutter,housefull
jongries taylorhandley trentford christophercain drama history romance western massacre mormon settler utah wagon train,september dawn
santiagocabrera eduardoverástegui catalinasandinomoreno deanwright drama history war catholic hanging mexico rebellion soldier,for greater glory: the true story of cristiada
karinviard ericelmosnino françoisdamiens ericlartigau comedy drama music audition deaf family relationships love singing,la famille bélier
robinwilliams mattdamon minniedriver gusvansant drama friend genius janitor loss of wife professor,good will hunting
alpacino anthonyhopkins glenpowell shintaroshimosawa drama thriller black panties lust sexual attraction voyeur voyeurism,misconduct
costasmandylor shawneesmith leighwhannell darrenlynnbousman horror mystery brutality female full frontal nudity female nudity torture trap,saw iii
billmurray haroldramis judgereinhold ivanreitman action comedy war army boot camp breasts graduation rescue,stripes
kirstendunst lindsaysloane clarekramer peytonreed comedy sport championship cheerleading high school teen comedy teenage romance,bring it on
frankgrillo josephjuliansoria mykeltiwilliamson jamesdemonaco action horror sci-fi thriller cathedral minister presidential election reference to george washington ritual sacrifice,the purge: election year
paulwalker cleaduvall kieranculkin robertiscove comedy romance bet friend high school prom prom queen,she's all that
mo'nique gaboureysidibe mariahcarey leedaniels drama abuse african american lesbian lesbian lesbian couple school,precious
costasmandylor shawneesmith angusmacfadyen darrenlynnbousman horror mystery detective fbi rape rapist serial rapist,saw iv
deborahkaraunger keeganconnortracy mikedopud geoffreysax drama horror mystery thriller architect grave obsession river voice,white noise
boriskodjoe cicelytyson blairunderwood tylerperry comedy drama romance cross dressing family reunion madea series reflective sister sister relationship,madea's family reunion
tomcruise billcobbs maryelizabethmastrantonio martinscorsese drama sport hustler losing pool pool player tournament,the color of money
richardburton richardbeymer eddiealbert kenannakin action drama history war allies d day invasion normandy world war two,the longest day
lanesmith shaunweiss eldenhenson stephenherek comedy drama family sport coach hockey team lawyer respect team,the mighty ducks
sarahmichellegellar cleaduvall tedraimi takashishimizu horror mystery thriller american curse japan nurse rage,the grudge
adamsandler kevinnealon francesbay dennisdugan comedy sport golf golf ball golfer grandmother's house tournament,happy gilmore
eileenbrennan patriciabelcher jonathanbreck victorsalva horror mystery demon gore record player tattoo wings,jeepers creepers
keanureeves georgecarlin alleong stephenherek adventure comedy music sci-fi failing student high school payphone teenager telephone booth,bill & ted's excellent adventure
oliverreed ronmoody jackwild carolreed drama family musical abuse child orphan orphanage pickpocket,oliver!
tomwilkinson penelopewilton celiaimrie johnmadden comedy drama hotel india marigold retiree retirement,the best exotic marigold hotel
diedrichbader andrewlawrence dabneycoleman chucksheetz animation comedy family mystery sci-fi friend principal summer summer camp summer vacation,recess: school's out
tinaturner brucespence angelorossitto georgemiller action adventure sci-fi thriller arena desert fight mad max post apocalypse,mad max beyond thunderdome
billduke vernonwells raedawnchong markl.lester action adventure thriller body count dictator jumping from an airplane knife fight one man army,commando
laurencohan rupertevans stephanielemelin williambrentbell horror mystery thriller animate doll doll england nanny surprise ending,the boy
bojananovakovic bokeemwoodbine geoffreyarend johnerickdowdle horror mystery thriller devil elevator hit and run throat slitting trapped in an elevator,devil
johnwitherspoon mikeepps kattwilliams marcusraboy comedy drama apartment christmas christmas present rent security guard,friday after next
linshaye hayleykiyoko leighwhannell leighwhannell fantasy horror thriller demon possession psychic supernatural teenager,insidious: chapter 3
mikestarr vanity keshiaknightpulliam michaelschultz action comedy drama music cult film kung fu kung fu classic martial arts title spoken by character,the last dragon
jasonstatham bradpitt jasonflemyng guyritchie comedy crime boxer boxing diamond fight gypsy,snatch
jefffahey austino'brien troyevans brettleonard horror sci-fi intelligence science runs amok scientist supernatural power virtual reality,the lawnmower man
arigraynor alexisdziena aaronyoo petersollett comedy drama music romance band gay gay friend love night,nick and norah's infinite playlist
mattdamon janeanegarofalo georgecarlin kevinsmith adventure comedy drama fantasy abortion abortion clinic angel church clinic,dogma
erikachristensen evaamurrimartino sallopez bobdolman comedy drama bartender groupie lawyer road trip writer,the banger sisters
albertbrooks alleong vicmorrow joedante fantasy horror sci-fi 1940s 1960s bar kick the can remake,twilight zone: the movie
bengazzara kevintighe kellylynch rowdyherrington action thriller bikini cult film fired from the job martial arts violence,road house
jadapinkettsmith sallirichardson-whitfield charless.dutton keenenivorywayans action comedy crime drugs ex cop gun fu machismo shootout,a low down dirty shame
erikachristensen shiriappleby jasonritter johnpolson drama thriller high school hospital new jersey stanford university swimming,swimfan
danecook dannywoodburn jessicasimpson gregcoolidge comedy romance competition date employee laser in eyes slacker,employee of the month
ethanembry laurenambrose charliekorsmo harryelfont comedy romance graduation high school letter nerd party,can't hardly wait
tomcruise williamsmith tomwaits francisfordcoppola crime drama dysfunctional family gang greaser holding someone's head underwater rivalry,the outsiders
brycedallashoward oonalaurence isiahwhitlockjr. davidlowery adventure family fantasy,pete's dragon
tomskerritt herbertlom anthonyzerbe davidcronenberg horror sci-fi thriller car accident coma evil politician psychic vision,the dead zone
lailahaley jamesransone jadenklein ciaránfoy horror mystery thriller deputy farmhouse nightmare private investigator rural,sinister 2
omarihardwick curtisarmstrong mikeepps salimakil drama music 1960s death girl group nightclub sister,sparkle
marleyshelton jessicacapshaw johnnywhitworth jamieblanks horror mystery thriller dance nosebleed revenge valentine valentine's day,valentine
millajovovich willpatton hakeemkae-kazim olatundeosunsanmi mystery sci-fi thriller abduction alaska alien owl patient,the fourth kind
merylstreep virginiamadsen lilytomlin robertaltman comedy drama music backstage country music cowboy radio singing,a prairie home companion
khandialexander clarencewilliamsiii steveharris leonichaso drama thriller african american harlem manhattan new york city manhattan new york city new york city urination,sugar hill
billydrago richardlynch eddiejones josephzito action thriller army nightmare one man army rescue spy,invasion u.s.a.
jurneesmollett-bell brandont.jackson shadmoss malcolmd.lee comedy drama music romance 1970s boy competition roller skates tubesocks,roll bounce
billmurray connienielsen oliviawilliams wesanderson comedy drama coming of age friendship private school student teacher,rushmore
davidzayas donaldfaison brittanydaniel colinstrause action sci-fi thriller apartment blue light drawing group of friends light,skyline
tinadesai celiaimrie ronaldpickup johnmadden comedy drama sequel,the second best exotic marigold hotel
juliaormond janekrakowski willowsmith patriciarozema drama family boarding house girl great depression house ohio,kit kittredge: an american girl
benfeldman chrisnoth vanessalengies markrosman comedy family romance e mail moving perfect man secret admirer suitor,the perfect man
denzelwashington nicholasturturro charliemurphy spikelee drama music romance comeback friend jazz stage trumpet,mo' better blues
steveoedekerk simonrhee jennifertung steveoedekerk action comedy chosen one comic violence intentionally bad kung fu stylized violence,kung pow: enter the fist
rebamcentire arianarichards michaelgross ronunderwood comedy horror sci-fi desert giant worm monster pipe bomb small town,tremors
kevinzegers lindybooth julianrichings robschmidt horror thriller forest mountain road stupid victim west virginia,wrong turn
dennisquaid davidcarradine randyquaid walterhill western bank breasts famous score last man standing revenge,the long riders
byronmann paulben-victor kimchan jamesfoley action crime drama mystery thriller chinatown illegal immigrant new york police triad,the corruptor
matthewmcconaughey tyesheridan samshepard jeffnichols drama 14 year old boat bounty hunter boy river,mud
wendimclendon-covey thomaslennon carlosalazraqui robertbengarant comedy crime beach police sex scene spring break vomiting,reno 911!: miami
